{
  "$schema": "../schemas/contract-field-registry.schema.json",
  "registry_id": "GHRE-ZC-FIELDS",
  "version": "1.0.0",
  "as_of_date": "2026-07-15",
  "record_counts": {
    "system": 46,
    "custom": 19,
    "total": 65
  },
  "allowed_custom_types": [
    "Text",
    "Date",
    "Number",
    "Currency",
    "Dropdown",
    "Single Checkbox",
    "Percent",
    "Phone",
    "Email"
  ],
  "official_sources": {
    "zoho-system-fields": "https://help.zoho.com/portal/en/kb/contracts/admin-guide/clause-library/articles/adding-and-managing-clauses",
    "zoho-metadata-api": "https://www.zoho.com/contracts/api/contract-type/get-contract-type-template-all-fields.html",
    "zoho-contract-create-api": "https://www.zoho.com/contracts/api/contract/create-contract.html",
    "zoho-template-mapping": "https://help.zoho.com/portal/en/kb/contracts/admin-guide/contract-types/creation-and-management/articles/managing-contract-types",
    "zoho-crm-field-metadata": "https://www.zoho.com/crm/developer/docs/api/v8/field-meta.html",
    "zoho-crm-custom-fields": "https://www.zoho.com/crm/developer/docs/api/v8/create-custom-field.html",
    "user-inventory-and-official-types": "User-supplied Zoho Contracts field inventory and 2026-07-15 tenant UI screenshot, interpreted using the official Zoho field definitions above."
  },
  "policies": {
    "integration_key": "Use the tenant-returned Zoho apiName, never a display label or guessed API name.",
    "api_name_verification": "All Zoho Contracts and CRM API names remain null until fetched from the authenticated metadata endpoints.",
    "source_of_truth": "CRM owns approved pre-authoring party, property, unit, and lease inputs. Zoho Contracts owns contract lifecycle fields and the resolved agreement snapshot. Executed document values are immutable snapshots.",
    "sync_direction": "Prefer one-way CRM-to-Contracts authoring. Do not create bidirectional field updates without an explicit conflict policy.",
    "public_repository": "Store definitions and validation only. Never store tenant names, addresses, phone numbers, emails, contract values, Zoho record IDs, OAuth tokens, or merged documents.",
    "date_interchange": "Use ISO 8601 YYYY-MM-DD between applications even though Zoho Contracts displays dates as MMM dd, yyyy.",
    "currency": "Zoho Contracts custom Currency uses the organization currency. Cross-application records must also carry or enforce the applicable ISO currency code.",
    "uploaded_template_limit": "Zoho states that Dropdown, Email, Phone, and Percent document fields cannot be mapped to system fields in uploaded templates."
  },
  "fields": [
    {
      "id": "agreement_name",
      "label": "Agreement Name",
      "classification": "system",
      "status": "active",
      "zoho": {"ui_type": null, "expected_native_type": "String", "api_name": null, "type_status": "official_system_semantics", "evidence_id": "zoho-system-fields"},
      "portable_type": "text",
      "crm": {"recommended_type": "Single Line", "proposed_api_name": "Agreement_Name", "api_name_status": "proposed_unverified"},
      "source_of_truth": "Zoho Contracts contract record",
      "sensitivity": "internal_contract",
      "validation": "Required; use a stable human-readable agreement title, not as a cross-system join key."
    },
    {
      "id": "party_a_jurisdiction",
      "label": "Party A Jurisdiction",
      "classification": "system",
      "status": "active",
      "zoho": {"ui_type": null, "expected_native_type": "String", "api_name": null, "type_status": "official_system_semantics", "evidence_id": "zoho-system-fields"},
      "portable_type": "text",
      "crm": {"recommended_type": "Pick List", "proposed_api_name": "Party_A_Jurisdiction", "api_name_status": "proposed_unverified"},
      "source_of_truth": "Zoho Contracts party metadata",
      "sensitivity": "internal_contract",
      "validation": "Use a controlled legal-jurisdiction code and label; do not treat postal state as jurisdiction automatically."
    },
    {
      "id": "party_a",
      "label": "Party A",
      "classification": "system",
      "status": "active",
      "zoho": {"ui_type": null, "expected_native_type": "Index", "api_name": null, "type_status": "official_system_semantics", "evidence_id": "zoho-system-fields"},
      "portable_type": "entity_reference",
      "crm": {"recommended_type": "Lookup", "proposed_api_name": "Party_A_Account", "api_name_status": "proposed_unverified"},
      "source_of_truth": "Zoho Contracts party assignment",
      "sensitivity": "restricted_pii",
      "validation": "Entity/short-name context; keep distinct from Party A Name and never use the display value as a join key."
    },
    {
      "id": "party_a_time_zone_name",
      "label": "Party A Time Zone Name",
      "classification": "system",
      "status": "review_required",
      "zoho": {"ui_type": null, "expected_native_type": "Unknown", "api_name": null, "type_status": "tenant_api_required", "evidence_id": "zoho-metadata-api"},
      "portable_type": "time_zone",
      "crm": {"recommended_type": "Pick List", "proposed_api_name": "Party_A_Time_Zone_Name", "api_name_status": "proposed_unverified"},
      "source_of_truth": "Zoho Contracts tenant metadata",
      "sensitivity": "internal_contract",
      "validation": "Fetch tenant metadata before mapping; if this is a zone name, store an IANA identifier rather than an abbreviation."
    },
    {
      "id": "party_b_time_zone_name",
      "label": "Party B Time Zone Name",
      "classification": "system",
      "status": "review_required",
      "zoho": {"ui_type": null, "expected_native_type": "Unknown", "api_name": null, "type_status": "tenant_api_required", "evidence_id": "zoho-metadata-api"},
      "portable_type": "time_zone",
      "crm": {"recommended_type": "Pick List", "proposed_api_name": "Party_B_Time_Zone_Name", "api_name_status": "proposed_unverified"},
      "source_of_truth": "Zoho Contracts tenant metadata",
      "sensitivity": "internal_contract",
      "validation": "Fetch tenant metadata before mapping; if this is a zone name, store an IANA identifier rather than an abbreviation."
    },
    {
      "id": "party_a_time_zone",
      "label": "Party A Time Zone",
      "classification": "system",
      "status": "review_required",
      "zoho": {"ui_type": null, "expected_native_type": "Unknown", "api_name": null, "type_status": "tenant_api_required", "evidence_id": "zoho-metadata-api"},
      "portable_type": "unknown",
      "crm": {"recommended_type": "Unresolved", "proposed_api_name": null, "api_name_status": "tenant_api_required"},
      "source_of_truth": "Zoho Contracts tenant metadata",
      "sensitivity": "internal_contract",
      "validation": "Do not create a CRM field until metadata establishes whether this is an offset, ID, or display value; derive offsets because of daylight-saving changes."
    },
    {
      "id": "party_b_time_zone",
      "label": "Party B Time Zone",
      "classification": "system",
      "status": "review_required",
      "zoho": {"ui_type": null, "expected_native_type": "Unknown", "api_name": null, "type_status": "tenant_api_required", "evidence_id": "zoho-metadata-api"},
      "portable_type": "unknown",
      "crm": {"recommended_type": "Unresolved", "proposed_api_name": null, "api_name_status": "tenant_api_required"},
      "source_of_truth": "Zoho Contracts tenant metadata",
      "sensitivity": "internal_contract",
      "validation": "Do not create a CRM field until metadata establishes whether this is an offset, ID, or display value; derive offsets because of daylight-saving changes."
    },
    {
      "id": "party_b_jurisdiction",
      "label": "Party B Jurisdiction",
      "classification": "system",
      "status": "active",
      "zoho": {"ui_type": null, "expected_native_type": "String", "api_name": null, "type_status": "official_system_semantics", "evidence_id": "zoho-system-fields"},
      "portable_type": "text",
      "crm": {"recommended_type": "Pick List", "proposed_api_name": "Party_B_Jurisdiction", "api_name_status": "proposed_unverified"},
      "source_of_truth": "Zoho Contracts party metadata",
      "sensitivity": "internal_contract",
      "validation": "Use a controlled legal-jurisdiction code and label; do not treat postal state as jurisdiction automatically."
    },
    {
      "id": "term_period",
      "label": "Term Period",
      "classification": "system",
      "status": "active",
      "zoho": {"ui_type": null, "expected_native_type": "Term", "api_name": null, "type_status": "official_system_semantics", "evidence_id": "zoho-system-fields"},
      "portable_type": "duration",
      "crm": {"recommended_type": "Composite", "proposed_api_name": null, "api_name_status": "design_required"},
      "source_of_truth": "Zoho Contracts contract record",
      "sensitivity": "internal_contract",
      "validation": "Represent as positive integer value plus explicit Months/Years unit; never convert months to 30 days or years to 365 days."
    },
    {
      "id": "term_end_trigger",
      "label": "Condition / Event / Fulfilment of Order / Completion of Services",
      "classification": "system",
      "status": "active",
      "aliases": ["Condition/Event/Fulfillment of Order/Completion of Services"],
      "zoho": {"ui_type": null, "expected_native_type": "Text", "api_name": null, "type_status": "official_system_semantics", "evidence_id": "zoho-system-fields"},
      "portable_type": "multiline_text",
      "crm": {"recommended_type": "Multi Line", "proposed_api_name": "Term_End_Trigger_Description", "api_name_status": "proposed_unverified"},
      "source_of_truth": "Zoho Contracts contract record",
      "sensitivity": "internal_contract",
      "validation": "Required when the contract ends by condition, event, order fulfillment, or service completion instead of a fixed end date."
    },
    {
      "id": "term_end_date",
      "label": "Term End Date",